<?xml version="1.0" encoding="UTF-8"?>
<XMLTooling xmlns:xsi="http://www.w3.org/2001/XMLSchema-instance" xmlns:wsp="http://schemas.xmlsoap.org/ws/2004/09/policy" xmlns="http://www.opensaml.org/xmltooling-config" xsi:schemaLocation="http://www.opensaml.org/xmltooling-config ../../src/schema/xmltooling-config.xsd">

    <!-- WS-Policy 2004 Object Providers -->
    <ObjectProviders>
    
        <!-- wsp:All -->
        <ObjectProvider qualifiedName="wsp:All">
            <BuilderClass className="org.opensaml.soap.wspolicy.impl.AllBuilder"/>
            <MarshallingClass className="org.opensaml.soap.wspolicy.impl.AllMarshaller"/>
            <UnmarshallingClass className="org.opensaml.soap.wspolicy.impl.AllUnmarshaller"/>
        </ObjectProvider>
        
        <!-- wsp:AppliesTo -->
        <ObjectProvider qualifiedName="wsp:AppliesTo">
            <BuilderClass className="org.opensaml.soap.wspolicy.impl.AppliesToBuilder"/>
            <MarshallingClass className="org.opensaml.soap.wspolicy.impl.AppliesToMarshaller"/>
            <UnmarshallingClass className="org.opensaml.soap.wspolicy.impl.AppliesToUnmarshaller"/>
        </ObjectProvider>
        
        <!-- wsp:ExactlyOne -->
        <ObjectProvider qualifiedName="wsp:ExactlyOne">
            <BuilderClass className="org.opensaml.soap.wspolicy.impl.ExactlyOneBuilder"/>
            <MarshallingClass className="org.opensaml.soap.wspolicy.impl.ExactlyOneMarshaller"/>
            <UnmarshallingClass className="org.opensaml.soap.wspolicy.impl.ExactlyOneUnmarshaller"/>
        </ObjectProvider>

        <!-- wsp:Policy -->
        <ObjectProvider qualifiedName="wsp:Policy">
            <BuilderClass className="org.opensaml.soap.wspolicy.impl.PolicyBuilder"/>
            <MarshallingClass className="org.opensaml.soap.wspolicy.impl.PolicyMarshaller"/>
            <UnmarshallingClass className="org.opensaml.soap.wspolicy.impl.PolicyUnmarshaller"/>
        </ObjectProvider>
        
        <!-- wsp:PolicyAttachment -->
        <ObjectProvider qualifiedName="wsp:PolicyAttachment">
            <BuilderClass className="org.opensaml.soap.wspolicy.impl.PolicyAttachmentBuilder"/>
            <MarshallingClass className="org.opensaml.soap.wspolicy.impl.PolicyAttachmentMarshaller"/>
            <UnmarshallingClass className="org.opensaml.soap.wspolicy.impl.PolicyAttachmentUnmarshaller"/>
        </ObjectProvider>

        <!-- wsp:PolicyReference -->
        <ObjectProvider qualifiedName="wsp:PolicyReference">
            <BuilderClass className="org.opensaml.soap.wspolicy.impl.PolicyReferenceBuilder"/>
            <MarshallingClass className="org.opensaml.soap.wspolicy.impl.PolicyReferenceMarshaller"/>
            <UnmarshallingClass className="org.opensaml.soap.wspolicy.impl.PolicyReferenceUnmarshaller"/>
        </ObjectProvider>

    </ObjectProviders>

</XMLTooling>
